# name: test/optimizer/max_len_skip.test
# description: Test precomputation of MIN/MAX aggregates over byte-length functions (strlen/octet_length)
# group: [optimizer]

statement ok
SET profiling_renderer_settings = MAP {'operator_casing': 'upper'};

require no_alternative_verify

# min_string_length/total_string_length are only persisted in the V2_0_0+ storage
# format; the default v0.10.2 compatibility format drops them on checkpoint
statement ok
SET storage_compatibility_version='latest';

statement ok
ATTACH '{TEST_DIR}/max_len_skip.duckdb' AS db (ROW_GROUP_SIZE 2048)

statement ok
USE db

# 4 row groups: [0-2047], [2048-4095], [4096-6143], [6144-8191]
# s has byte length (i % 100) + 1, i.e. 1..100, so every row group has max_string_length = 100,
# min_string_length = 1
statement ok
CREATE TABLE t AS (SELECT i, repeat('a', (i % 100) + 1) AS s FROM range(8192) _(i));

# Reopen to clear version info
statement ok
ATTACH '{TEST_DIR}/tmp_max_len_skip.duckdb' AS tmp

statement ok
USE tmp

statement ok
DETACH db

statement ok
ATTACH '{TEST_DIR}/max_len_skip.duckdb' AS db (ROW_GROUP_SIZE 2048)

statement ok
USE db

statement ok
DETACH tmp

# Full precompute: MAX(strlen(s)) is folded from the exact string stats, no scan
query II
EXPLAIN SELECT max(strlen(s)) FROM t
----
physical_plan	<!REGEX>:.*UNGROUPED_AGGREGATE.*

query I
SELECT max(strlen(s)) FROM t
----
100

# MIN over a length function folds as well
query II
EXPLAIN SELECT min(strlen(s)) FROM t
----
physical_plan	<!REGEX>:.*UNGROUPED_AGGREGATE.*

query I
SELECT min(strlen(s)) FROM t
----
1

# Mixed with count_star and a plain column max: all precomputed
query II
EXPLAIN SELECT count(*), max(strlen(s)), max(i) FROM t
----
physical_plan	<!REGEX>:.*UNGROUPED_AGGREGATE.*

query III
SELECT count(*), max(strlen(s)), max(i) FROM t
----
8192	100	8191

# When strlen(s) is shared by multiple aggregates, the common subexpression is
# lifted into a projection - the length optimization still applies
query II
EXPLAIN SELECT max(strlen(s)), min(strlen(s)) FROM t
----
physical_plan	<!REGEX>:.*UNGROUPED_AGGREGATE.*

query II
SELECT max(strlen(s)), min(strlen(s)) FROM t
----
100	1

# length() is a code point count, not byte length - Phase B does not optimize it,
# the aggregate is executed normally
statement ok
CREATE TABLE t_unicode AS (SELECT i, CASE WHEN i % 10 = 0 THEN '你好世界' ELSE 'abc' END AS s
                           FROM range(2048) _(i));

query II
EXPLAIN SELECT max(length(s)) FROM t_unicode
----
physical_plan	<REGEX>:.*UNGROUPED_AGGREGATE.*

query I
SELECT max(length(s)) FROM t_unicode
----
4

# BLOB columns with octet_length
statement ok
CREATE TABLE t_blob AS (SELECT i, CAST(repeat('x', (i % 10) + 1) AS BLOB) AS b FROM range(2048) _(i));

# Reopen to clear row group change tracking
statement ok
ATTACH '{TEST_DIR}/tmp2_max_len_skip.duckdb' AS tmp2

statement ok
USE tmp2

statement ok
DETACH db

statement ok
ATTACH '{TEST_DIR}/max_len_skip.duckdb' AS db (ROW_GROUP_SIZE 2048)

statement ok
USE db

statement ok
DETACH tmp2

query II
EXPLAIN SELECT max(octet_length(b)) FROM t_blob
----
physical_plan	<!REGEX>:.*UNGROUPED_AGGREGATE.*

query I
SELECT max(octet_length(b)) FROM t_blob
----
10

# The aggregate can be traced through a projection (e.g. a view)
statement ok
CREATE VIEW v AS (SELECT i, strlen(s) AS len FROM t);

query II
EXPLAIN SELECT max(len) FROM v
----
physical_plan	<!REGEX>:.*UNGROUPED_AGGREGATE.*

query I
SELECT max(len) FROM v
----
100

# A fully NULL column has no length value: no precompute, the aggregate returns NULL
statement ok
CREATE TABLE t_null AS (SELECT i, CAST(NULL AS VARCHAR) AS s FROM range(8192) _(i));

query II
EXPLAIN SELECT max(strlen(s)) FROM t_null
----
physical_plan	<REGEX>:.*UNGROUPED_AGGREGATE.*

query I
SELECT max(strlen(s)) FROM t_null
----
NULL

# An empty table: no partition stats, no optimization
statement ok
CREATE TABLE t_empty AS (SELECT * FROM t WHERE 1 = 0);

query II
EXPLAIN SELECT max(strlen(s)) FROM t_empty
----
physical_plan	<REGEX>:.*UNGROUPED_AGGREGATE.*

query I
SELECT max(strlen(s)) FROM t_empty
----
NULL

# Prevent automatic checkpoints: a checkpoint rewrites the row group and re-tightens its statistics
statement ok
SET checkpoint_threshold = '1TB'

# An update marks row group 0 as changed: its length stats become inexact,
# the other 3 row groups are precomputed
statement ok
UPDATE t SET s = repeat('b', 200) WHERE i = 100

query II
EXPLAIN SELECT max(strlen(s)) FROM t
----
physical_plan	<REGEX>:.*COALESCE.*greatest.*UNGROUPED_AGGREGATE.*

query I
SELECT max(strlen(s)) FROM t
----
200

# The same update makes MIN partial: only row group 0 needs to be scanned
query II
EXPLAIN SELECT min(strlen(s)) FROM t
----
physical_plan	<REGEX>:.*COALESCE.*least.*UNGROUPED_AGGREGATE.*

query I
SELECT min(strlen(s)) FROM t
----
1

# A delete makes the count of row group 0 approximate: it is scanned, the rest are folded
statement ok
DELETE FROM t WHERE i = 100

query II
EXPLAIN SELECT max(strlen(s)) FROM t
----
physical_plan	<REGEX>:.*COALESCE.*greatest.*UNGROUPED_AGGREGATE.*

query I
SELECT max(strlen(s)) FROM t
----
100
